{
  "runID": "rails-rspec-20260624",
  "source": {
    "image": "example.com/sporevm/rails-rspec:sha-1111111",
    "platform": "linux/arm64"
  },
  "prepare": {
    "command": [
      "/bin/bash",
      "/usr/local/bin/sporevm-rails-coordinator",
      "--capture-delay",
      "2"
    ],
    "captureSignal": "USR1",
    "readyMarker": "SPOREVM_RAILS_READY"
  },
  "fork": {
    "count": 1000
  },
  "children": {
    "start": 0,
    "count": 1000,
    "command": [
      "/usr/local/bin/sporevm-rspec-shard"
    ]
  },
  "execution": {
    "childrenPerShard": 100,
    "maxInFlightPerAgent": 100
  },
  "retryPolicy": {
    "maxAttemptsPerChild": 2,
    "rerunCommittedChildren": false
  },
  "sideEffects": {
    "idempotencyRequired": true
  },
  "resultStore": "s3://example-sporevm-results/rails-rspec-20260624/"
}
